{
  "schema": "p2p.manifest/v2",
  "run_id": "r_01jb7z00000000000000000000",
  "attempt": 1,
  "image_digest": "sha256:0000000000000000000000000000000000000000000000000000000000000000",
  "entrypoint": "workspace/train.py",
  "args": [
    "--epochs",
    "5"
  ],
  "seeds": [
    0,
    1,
    2
  ],
  "budget_seconds": 1500,
  "paths": {
    "overlay": "/mnt/run/staging/overlay.tar.zst",
    "repo": null,
    "data_dir": "/mnt/run/staging/data",
    "workspace": "/mnt/run/staging/workspace.tar",
    "cache": "/mnt/cache",
    "results": "/mnt/run/results/1"
  },
  "claims": [
    {
      "claim_ref": "c1",
      "claim_type": "RELATIVE",
      "metric": "top1_accuracy",
      "higher_is_better": true,
      "metric_key": "method/top1_accuracy",
      "baseline_name": "resnet18",
      "baseline_key": "resnet18/top1_accuracy"
    },
    {
      "claim_ref": "c2",
      "claim_type": "ABSOLUTE",
      "metric": "top1_accuracy",
      "higher_is_better": true,
      "metric_key": "method/top1_accuracy",
      "baseline_name": null,
      "baseline_key": null
    }
  ],
  "scale": {
    "full": false,
    "fraction_of_data": 0.1,
    "epochs": 5,
    "paper_epochs": 200
  },
  "archives": {
    "overlay": "aaaaaaaaaaaaaaaaaaaaaaaaaaaaaaaaaaaaaaaaaaaaaaaaaaaaaaaaaaaaaaaa",
    "repo": null,
    "data": [
      {
        "name": "uoft-cs__cifar10",
        "sha256": "bbbbbbbbbbbbbbbbbbbbbbbbbbbbbbbbbbbbbbbbbbbbbbbbbbbbbbbbbbbbbbbb"
      }
    ]
  },
  "workspace_sha256": "ffffffffffffffffffffffffffffffffffffffffffffffffffffffffffffffff"
}
